alteration_staff;Staff of Alteration;;;;;;;;;;;;;x
alteration_staff_desc;A rare, hard to obtain Staff imbued with the powers of Alteration.;;;;;;;;;;;;;x
atronach;Atronach (Familiar);;;;;;;;;;;;;x
atronach_desc;[Root.GetFirstName] has somehow tamed an atronach, a being formed from the energies of Oblivion.;;;;;;;;;;;;;x
auriels_bow;Auriel's Bow;;;;;;;;;;;;;x
auriels_bow_desc;Auriel's Bow is an artifact created and used by the Elven god Auriel, an aspect of the Imperial Akatosh, the Dragon God of Time. Although it takes the form of a modest Elven Moonstone bow, it is one of the most powerful weapons in Tamriel.;;;;;;;;;;;;;x
shield_auriel;Auriel's Shield;;;;;;;;;;;;;x
FORMER_COFFER_OWNER_TT;Is of Orgnum's Blood or has not previously had the Coffer within the past 25 years.;;;;;;;;;;;;;x
shield_auriel_desc;Auriel's Shield is an artifact created and used by the Elven god Auriel, an aspect of the Imperial Akatosh, the Dragon God of Time. It takes the form of a small shield, sometimes rounded, made from either ebony or moonstone. It has several magickal abilities that help to make its wielder nigh invulnerable.;;;;;;;;;;;;;x
azuras_star;Azura's Star;;;;;;;;;;;;;x
azuras_star_desc;Azura's Star is a Daedric artifact created by the Daedric Prince Azura. In appearance it looks like a large, intricately designed throwing star. In the right hands, Azura's Star acts as a reusable soul gem of almost unlimited capacity. This makes it highly sought by mages and assassins.;;;;;;;;;;;;;x
band_of_arcane_sight;Band of Arcane Sight;;;;;;;;;;;;;x
band_of_arcane_sight_desc;This ring is heavily enchanted with a variety of Mystic detection spells, allowing for partial mitigation of the effects of blindness.;;;;;;;;;;;;;x
book_guide_to_tamriel;The Emperor's Guide to Tamriel;;;;;;;;;;;;;x
book_guide_to_tamriel_desc;Author: [event_target:gtt_author.GetDynName]\nA comprehensive text describing the histories and cultures of each of Tamriel's provinces.;;;;;;;;;;;;;x
book_guide_to_tamriel_improved;The Improved Emperor's Guide to Tamriel;;;;;;;;;;;;;x
book_guide_to_tamriel_improved_desc;Author: Flaccus Terentius\nThe Improved Emperor's Guide to Tamriel is a 224-page illustrated guide written and illustrated by the Imperial scholar, Flaccus Terentius and commissioned in 2E 581. The prior Emperor's Guide to Tamriel forms the bulk of the work, with additional transcripts of the author's travels through Tamriel and various excerpts and notes from additional, relevant works procured in the various provinces of Tamriel.;;;;;;;;;;;;;x
book_pocket_guide_1;Pocket Guide to the Empire, 1st Edition;;;;;;;;;;;;;x
book_pocket_guide_2;Pocket Guide to the Empire, 2nd Edition;;;;;;;;;;;;;x
book_pocket_guide_3;Pocket Guide to the Empire, 3rd Edition;;;;;;;;;;;;;x
book_pocket_guide_4;Pocket Guide to the Empire, 4th Edition;;;;;;;;;;;;;x
book_pocket_guide_5;Pocket Guide to the Empire, 5th Edition;;;;;;;;;;;;;x
book_pocket_guide_1_desc;Author: [event_target:pg1_author.GetDynName], on behalf of the Imperial Geographical Society\The Pocket Guide to the Empire was an attempt to popularise and update the older, and by then heavily outdated Improved Emperor's Guide to Tamriel. The texts are shorter than the predecessor manuals but the Guide accomplished its task, being widely distributed by the IGS across Tamriel and helping bring together the various peoples of Tamriel. Critics commenting on the Guide however claim it is little more than a piece of biased propaganda.;;;;;;;;;;;;;x
book_pocket_guide_2_desc;Author: [event_target:pg2_author.GetDynName], on behalf of the Imperial Geographical Society\nThe 2nd Edition of the popular Pocket Guide. Similarly to its predecessor, the 2nd Edition features informative, dense texts and pictorials of the various peoples and places of Tamriel. The 2nd Edition attempted to provide more information than the 1st Edition but according to critics it was still heavily biased toward the author's favoured peoples, depicting those of other cultures to be more primitive and backwards than the author's own. The so-called "Pocket" Guide 2nd Edition was also too large to comfortably fit a normal sized person's pockets...;;;;;;;;;;;;;x
book_pocket_guide_3_desc;Author: [event_target:pg3_author.GetDynName], on behalf of the Imperial Geographical Society\nThe 3rd Edition of the Pocket Guide would go on to be the most popular text released by the Imperial Geographical Society. The 3rd Edition returned to the roots of the 1st Edition by abridging much of the information of the second and updating it for a new generation. Much of the bias of the older Guides was replaced with a more optimistic view of the various cultures of Tamriel in a fairer manner. Some biases were of course still present, but critics viewed them more as the innocence and naivety of the author than intentional derogation of "lesser" peoples.;;;;;;;;;;;;;x
book_pocket_guide_4_desc;Author: [event_target:pg4_author.GetDynName], on behalf of the Imperial Geographical Society\nThe 4th Edition of the famous Pocket Guide, commissioned by the Imperial Geographical Society to replace the 3rd Edition. The 4th is generally considered to be rather "flat" as far as the Pocket Guides went, offering little new information although the illustrations and maps provided with the Guide were very popular with travellers.;;;;;;;;;;;;;x
book_pocket_guide_5_desc;Author: [event_target:pg5_author.GetDynName], on behalf of the Imperial Geographical Society\nThe 5th Edition of the famous Pocket Guide is considered to be the most complete and unbiased edition of the Guide to date. Brief but comprehensive, the Guide offered a remarkably unbiased view of the cultures, history and places of Tamriel though critics claimed that in the pursuit of fairness and fact much of the "flavour" and artistic penmanship of the prior Editions was lost.;;;;;;;;;;;;;x
book_abcs_for_barbarians;ABCs for Barbarians;;;;;;;;;;;;;x
book_abcs_for_barbarians_desc;This illustrated guide to the Cyrodilic alphabet is a simple, easy-to-use tool for basic literacy. Its hand-drawn pictures are based on fauna, flora and other familiar sights from Morrowind.;;;;;;;;;;;;;x
book_boethiah_pillow_book;Boethiah's Pillow Book;;;;;;;;;;;;;x
book_boethiah_pillow_book_desc;No words can describe what you see. Or what you think you see.;;;;;;;;;;;;;x
book_chances_folly;Chance's Folly;;;;;;;;;;;;;x
book_chances_folly_desc;Chance's Folly is the story by Zylmoc Golge, about a talented but arrogant and underhanded thief's untimely demise. The thief, whose alter ego is known as Chance, attempts to ransack a Dunmer ancestral tomb with the aid of a Breton madman who acts as muscle while she picks the locks. Chance underestimates her partner as well as the tomb's defenses, perishing within - but not before bypassing innumerable locks and traps.;;;;;;;;;;;;;x
book_father_of_the_niben;Father of the Niben;;;;;;;;;;;;;x
book_father_of_the_niben_desc;Composed by Florin Jaliil, this is a translation of the ancient Aldmeri Udhendra Nibenu, writings pertaining to the Aldmeri explorer Topal the Pilot and his expedition to find Old Ehlnofey. The book chronicles Topal's exploits, in particular his victory over a large, leathery-winged beast which he brought down through skillful use of the bow and arrow.;;;;;;;;;;;;;x
book_fundaments_of_alchemy;Fundaments of Alchemy;;;;;;;;;;;;;x
book_fundaments_of_alchemy_desc;Alyandon Mathierry's introductory treatise on alchemy provides a concise, easy-to-understand summary of the core concepts of alchemical study, including the tools of the trade, sampling ingredients, and concocting simple potions.;;;;;;;;;;;;;x 
book_fall_of_the_snow_prince;Fall of the Snow Prince;;;;;;;;;;;;;x
book_fall_of_the_snow_prince_desc;Fall of the Snow Prince is a dramatic retelling of the ancient Battle of Moesring, as transcribed by Lokheim, chronicler to chieftain Ingjaldr White-Eye. This book is particularly germane for its account regarding the titular character, a charismatic Falmer leader who valiantly led his people in an ill-fated final stand against the Atmoran invaders and was buried by his foes with dignity and reverence.;;;;;;;;;;;;;x
book_liminal_bridges;Liminal Bridges;;;;;;;;;;;;;x
book_liminal_bridges_desc;Written by Camilonwe of Alinor, this scholarly text provides theoretical and practical information pertaining to transportation between Mundus and Oblivion, backed up with additional documentation. Of particular note is its summary of how to open a gate to Oblivion through the use of a sigil stone.;;;;;;;;;;;;;x
book_hanging_gardens;Hanging Gardens of Wasten Coridale;;;;;;;;;;;;;x
book_hanging_gardens_desc;Although it appears to be little more than a simple travelogue, this book is written in Aldmeris and Dwemeris, presenting readers with a treasure trove of ancient linguistic and literary techniques.;;;;;;;;;;;;;x
book_nchunaks_fire_and_faith;Nchunak's Fire and Faith;;;;;;;;;;;;;x
book_nchunaks_fire_and_faith_desc;Allegedly a translation of the adventures of the traveler Nchunak, this text depicts the cultural and philosophical values of the Dwemer who lived during the time of Kagrenac, including some contemporary Dwemer viewpoints on Kagrenac's theories.;;;;;;;;;;;;;x
book_ngasta_kvata_kvakis;N'Gasta! Kvata! Kvakis!;;;;;;;;;;;;;x
book_ngasta_kvata_kvakis_desc;Authored by the Sload necromancer N'Gasta, this esoteric tome contains a bevy of magickal knowledge that can only truly be understood by one capable of speaking the difficult Sload language.;;;;;;;;;;;;;x
book_notes_on_racial_phylogeny;Notes on Racial Phylogeny;;;;;;;;;;;;;x
book_notes_on_racial_phylogeny_desc;This treatise, compiled by the Arcane University's Council of Healers, examines some of the biological differences between various races of Tamriel, their reproductive compatibilities and incompatibilities, and the nature of "race," all through a scholarly lens.;;;;;;;;;;;;;x
book_rislav_the_righteous;Rislav the Righteous;;;;;;;;;;;;;x
book_rislav_the_righteous_desc;Written by Sinjin, this is a retrospective biography on the life of Rislav Larich, King of Skingrad during the First Era. Rislav the Righteous details the Colovian monarch's rise to power, his political dealings, and his shocking victory against the forces of the Alessian Empire. Details within the book include an analysis of First Era Colovian military equipment and tactics.;;;;;;;;;;;;;x
book_smithing_a_worthy_endeavor;Smithing - A Worthy Endeavor;;;;;;;;;;;;;x
book_smithing_a_worthy_endeavor_desc;Cuinaamo's treatise on smithing focuses on the mental side of proper smithing, looking less at the mechanical techniques required to forge arms and armor, and instead at the proper mindset that a reader should purportedly have in order to succeed in crafting equipment. The book likens smithing to studying magic, instructing the reader to stay positive and determined on the path to mastering their craft.;;;;;;;;;;;;;x
book_strakes_and_futtocks;Strakes and Futtocks;;;;;;;;;;;;;x
book_strakes_and_futtocks_desc;This short guide by shipwright Curly Lainlyn contains concise instructions on the correct way to construct a seaworthy vessel. It stresses a standardized methodology for shipbuilding, and explains the purposes behind such techniques as rabbeting timber and cutting lumber from angled trunks to utilize their natural curvature.;;;;;;;;;;;;;x
book_the_buying_game;The Buying Game;;;;;;;;;;;;;x
book_the_buying_game_desc;This trade manual from Adabael Timsar-Dadisun describes commerce as a game that "everyone can win" and includes suggestions with how to interface with merchants - what to look for, what to say, and knowing the right circumstances for making a purchase.;;;;;;;;;;;;;x
book_the_lusty_argonian_maid;The Lusty Argonian Maid;;;;;;;;;;;;;x
book_the_lusty_argonian_maid_desc;Laden with innuendo and double-entendre, this bawdy play from Crassus Curio relates the sexual adventures of a privileged nobleman and his Argonian maidservant, and their effort to hide their romance from the noble's jealous wife.;;;;;;;;;;;;;x
book_wulfmares_guide;Wulfmare's Guide to Better Thieving;;;;;;;;;;;;;x
book_wulfmares_guide_desc;Although the self-proclaimed accomplishments of the apparent author Wulfmare are impossible to verify, the Guide to Better Thieving reflects significant understanding in how to commit acts of subversion. The fundamentals of pickpocketing and lockpicking, two core thieving skillsets, are thoroughly described.;;;;;;;;;;;;;x
book_gods_and_worship;Gods and Worship in Tamriel;;;;;;;;;;;;;x
book_gods_and_worship_desc;This is an introductory guide to Tamrielic theology and spirituality, written by Brother Hetchfield of the Imperial University. Positing several hypotheses on the nature of Tamriel's deities, it does not assert any one as being any more valid than any other, possibly to help the reader reach their own conclusion.;;;;;;;;;;;;;x
book_remanada;Remanada;;;;;;;;;;;;;x
book_remanada_desc;Remanada is the mythological retelling of the rise of Reman - the hero who defeated the Akaviri invasion of Tamriel established the Cyrodilic Empire - and the chaos that ensued following the collapse of his dynasty.;;;;;;;;;;;;;x
book_spirit_of_nirn;Spirit of Nirn;;;;;;;;;;;;;x
book_spirit_of_nirn_desc;This short text explains the religious importance of Lorkhan and the fundamental disagreements resulting from his involvement in the creation of the mortal plane. In addition, the book explores competing hypotheses as to the purpose of Nirn itself.;;;;;;;;;;;;;x
book_song_of_askelde_men;Song of the Askelde Men;;;;;;;;;;;;;x
book_song_of_askelde_men_desc;A traditional Nordic poem, Song of the Askelde Men tells the story of a wistful ghost's attempt at vengeance against the men responsible for its death - through the ghost's own perspective. Although a work of fiction, it almost certainly provides valuable insight into Nordic funerary rites and beliefs about the dead.;;;;;;;;;;;;;x
book_withershins;Withershins;;;;;;;;;;;;;x
book_withershins_desc;This tale by Yaqut Tawashi features a distressed Argonian tailor by the name of Zaki, who is positive that all of his conversations flow in alphabetical order. He consults a peculiar healer who, with a zoetrope and some magickal incantations, cures the bizarre ailment - with the added side effect of speaking words in reverse order and causing Zaki to walk backwards.;;;;;;;;;;;;;x
badger;Colovian Badger;;;;;;;;;;;;;x
badger_desc;This ill-tempered creature is more than a handful to take care of, but is ferocious and quite a menace to anyone who dares threaten its owner.;;;;;;;;;;;;;x
blackhands_dagger;Black Hands Dagger;;;;;;;;;;;;;x
blackhands_dagger_desc;The Black Hands Dagger is a minor artifact favoured by assassins.;;;;;;;;;;;;;x
black_star;Black Star;;;;;;;;;;;;;x
black_star_desc;The Black Star is a corrupted form of Azura's Star capable of containing the souls of sentient beings such as Man and Mer.;;;;;;;;;;;;;x
head_crown_jagged;Jagged Crown;;;;;;;;;;;;;x
head_crown_jagged_desc;The Jagged Crown is a unique helm and ancient relic that has served as a symbol of leadership and power for kings and queens of Skyrim since the First Era.;;;;;;;;;;;;;x
blade_of_woe;Blade of Woe;;;;;;;;;;;;;x
blade_of_woe_desc;The Blade of Woe is an old assassin's blade with a feared reputation, most often found in the hands of a favoured member of the Dark Brotherhood.;;;;;;;;;;;;;x
bodyguard;Bodyguard (Familiar);;;;;;;;;;;;;x
bodyguard_desc;A heavy set, intimidating and often heavily armed individual can always be found in the presence of [Root.GetFirstName], rarely more than a few feet away.;;;;;;;;;;;;;x
boots_of_silence;Boots of Silence;;;;;;;;;;;;;x
boots_of_silence_desc;These enchanted boots are a highly sought after prize for any thief or shady character.;;;;;;;;;;;;;x
bow_shadows;Bow of Shadows;;;;;;;;;;;;;x
bow_shadows_desc;Legend has it that the Bow of Shadows was forged by the Daedra Nocturnal. The legendary ranger, Raerlas Ghile, was granted the Bow for a secret mission that failed, and the Bow was lost. Raerlas did not go down without a hearty fight and is said to have, with the aid of the Bow, taken scores of his foes with him.;;;;;;;;;;;;;x
pet_cat;Cat;;;;;;;;;;;;;x
pet_cat_desc;A cat has deigned to grant this individual its company, for which said individual is likely very excited.;;;;;;;;;;;;;x
weapon_chrysamere;Chrysamere;;;;;;;;;;;;;x
weapon_chrysamere_desc;Chrysamere, the Paladin's Blade and Sword of Heroes, is an ancient claymore with offensive capabilities only surpassed by its defences.;;;;;;;;;;;;;x
weapon_clutterbane;Clutterbane;;;;;;;;;;;;;x
weapon_clutterbane_desc;Everything Must Go!;;;;;;;;;;;;;x
conjuration_staff;Staff of Conjuration;;;;;;;;;;;;;x
conjuration_staff_desc;A rare, hard to obtain Staff imbued with the powers of Conjuration.;;;;;;;;;;;;;x
crown_argonia;The Marsh Crown;;;;;;;;;;;;;x
crown_argonia_desc;The Marsh Crown is the symbol of power for the Kingdom of Argonia, or Black Marsh.;;;;;;;;;;;;;x
crown_lilmoth;Crown of Lilmoth;;;;;;;;;;;;;x
crown_lilmoth_desc;The traditional symbol of power for the Kingdom of Lilmoth;;;;;;;;;;;;;x
crown_skyrim;Helm of the High King (Crown);;;;;;;;;;;;;x
crown_skyrim_desc;The Helm of the High King is said to have been worn by Ysgramor himself during his battles and the original formation of Skyrim. It has long since served as the Crown of the King, and is an important symbol of office.;;;;;;;;;;;;;x
crown_soulrest;Crown of Souls (Crown);;;;;;;;;;;;;x
crown_soulrest_desc;The Crown of Restful Souls is the traditional symbol of power for the Kingdom of Soulrest.;;;;;;;;;;;;;x
crown_stormhold;Crown of Storms (Crown);;;;;;;;;;;;;x
crown_stormhold_adj;The Crown of Storms is the traditional symbol of power for the Kingdom of Soulrest.;;;;;;;;;;;;;x
crown_thorn;Crown of Thorns (Crown);;;;;;;;;;;;;x
crown_thorn_desc;The Crown of Thorns is the traditional symbol of power for the Kingdom of Thorn.;;;;;;;;;;;;;x
crown_valenwood;Crown of Valenwood (Crown);;;;;;;;;;;;;x
crown_valenwood_desc;This is the Crown of Valenwood, the symbol of the wood-King and his authority.;;;;;;;;;;;;;x
weapon_daedric_crescent;Daedric Crescent;;;;;;;;;;;;;x
weapon_daedric_crescent_desc;Probably the most rare and even outlawed item of all the great prizes is the Daedric Crescent Blade. The Blade was used by Mehrunes Dagon's Daedric forces in the capture of the Imperial Battlespire.;;;;;;;;;;;;;x
weapon_dawnbreaker;Dawnbreaker;;;;;;;;;;;;;x
weapon_dawnbreaker_desc;Dawnbreaker is a powerful sword granted by the Daedric Prince Meridia who aid her in ridding the world of the undead, whom she abhors for their lack of living energy.;;;;;;;;;;;;;x
weapon_sword_of_edge;Blade of Edge;;;;;;;;;;;;x
weapon_sword_of_edge_desc;A black and red blade covered in needless spikes. It's so sharp you need protective equipment just to wield it.;;;;;;;;;;;;;x
destruction_staff;Staff of Destruction;;;;;;;;;;;;;x
destruction_staff_desc;A rare, hard to obtain Staff imbued with the powers of Destruction.;;;;;;;;;;;;;x
pet_dog;Hound (Familiar);;;;;;;;;;;;;x
pet_dog_desc;[Root.GetFirstName] has earned the loyalty of a hound, and the beast can never be found far from their side.;;;;;;;;;;;;;x
dragonbone_armor;Dragonbone Armour;;;;;;;;;;;;;x
dragonbone_armor_desc;This suit of armour is one of the greatest artifacts any collector or hero could own, it is constructed of real dragon bone. It is a truly exquisite piece of work and many have sought to possess it.;;;;;;;;;;;;;x
dragonbone_misc;Dragonbones;;;;;;;;;;;;;x
dragonbone_misc_desc;This odd collection of bones apparently once belonged to a Dragon.;;;;;;;;;;;;;x
dragonclaw_ornament;Ornamental Dragonclaw;;;;;;;;;;;;;x
dragonclaw_ornament_desc;An ornamental dragonclaw, a relic of a bygone era in Skyrim's history. Its exact use is unknown.;;;;;;;;;;;;;x
dres_banner;Banner of House Dres;;;;;;;;;;;;;x
dres_banner_desc;This old, dusty Banner was, according to the legends of House Dres, carried by a victorious ancestor during the Four-Score War. It has since taken on symbolic importance within the House itself, and is, or was, present at all official functions and events.;;;;;;;;;;;;;x
dres_lizardskin;Skin of the Lizard-King;;;;;;;;;;;;;x
dres_lizardskin_desc;This dried, fragile skin once adorned the bones of an Argonian Warchief who sought to rally his people against the incursions of the dark-skinned Dunmer. His 'rebellion' ended with a crushing defeat, and the Slavemasters of House Dres made an example of him, removing his skin via magickal, albeit no less painful, means before his assembled Army, now in chains. The Skin has since adorned the walls of House Dres's Family Keep, overlooking the throne of the House Elder.;;;;;;;;;;;;;x
dres_shield;Founder's Shield;;;;;;;;;;;;;x
dres_shield_desc;A simple shield of common Dunmer design. It is said to be the last surviving artifact of the original founder of House Dres and is an important artifact to the House.;;;;;;;;;;;;;x
dres_vinewhip;Harrada Vinewhip;;;;;;;;;;;;;x
dres_vinewhip_desc;A sinister looking, barbed whip fashioned from an enchanted Harrada Root. Some of the original plants 'life' still flows through the whip, waving back and forth like a snake, coiling about its victim's necks. This unique weapon is an artifact originally belonging to House Dres of Morrowind, and was apparently a constant companion of one of the first Dres slave-masters.;;;;;;;;;;;;;x
dwarven_armour;Dwarven Armour;;;;;;;;;;;;;x
dwarven_armour_desc;A Suit of Dwarven Armour, likely recovered deep from within some Dwemer ruins.;;;;;;;;;;;;;x
dwarven_sword;Dwarven Weapon;;;;;;;;;;;;;x
dwarven_sword_desc;An rather basic weapon of Dwarven design, likely recovered from Dwemer ruins.;;;;;;;;;;;;;x
dwemer_puzzle;Dwemer Puzzle Cube;;;;;;;;;;;;;x
dwemer_puzzle_desc;A Dwemer Puzzle Cube, a rather complex invention of the dwarves. No one is quite sure of its true purpose any more, perhaps it was a child's toy, or a key of some kind? Whatever the case, it certainly brightens up any boring afternoon at court.;;;;;;;;;;;;;x
dwemer_schematics;Dwemer Schematics;;;;;;;;;;;;;x
dwemer_schematics_desc;A collection of translated Dwemeri schematics, blueprints, and build plans recovered from an ancient ruin. These texts will provide us with great insight on engineering and construction techniques from the lost Deep Folk.;;;;;;;;;;;;;x
easter_egg_t;Easter Egg;;;;;;;;;;;;;x
easter_egg_t_desc;This is an Easter Egg. It does absolutely nothing.;;;;;;;;;;;;;x
ebonymail;Ebony Mail;;;;;;;;;;;;;x
ebonymail_desc;The Ebony Mail is a Daedric artifact created by the Daedric Prince Boethiah. In appearance it looks like a simple ebony cuirass. It can either be medium or heavy in weight. The artifact grants its wearer resistance to fire and magickal attacks, magickal protection from physical blows, quieter movements and the ability to poison enemies who get too close.;;;;;;;;;;;;;x
ebony_armour;Ebony Armour;;;;;;;;;;;;;x
ebony_armour_desc;A rare suit of Ebony Armour.;;;;;;;;;;;;;x
ebony_battleaxe;Ebony Weapon;;;;;;;;;;;;;x
ebony_battleaxe_desc;A rare, masterwork Ebony Weapon.;;;;;;;;;;;;;x
weapon_ebonyblade;Ebony Blade;;;;;;;;;;;;;x
weapon_ebonyblade_desc;The Ebony Blade, sometimes called the Vampire or the Leech, resembles an ebony katana, and its power is very dark indeed. Every time the Ebony Blade strikes an opponent, part of the damage inflicted flows into the wielder as raw power. The Blade itself may not be any more evil than those who have used it, but at some point in its history, a charm was cast on it so it would not remain with any one individual for long. The wizard who cast this charm sought to save the souls of any too infatuated by the Blade, and perhaps he was right to do so.;;;;;;;;;;;;;x
elder_scroll;Elder Scroll;;;;;;;;;;;;;x
elder_scroll_desc;The eponymous Elder Scrolls are artifacts of unknown origin and quantity, being simultaneously archives of both historic and future events. Those with the gift of prescience or divination are able to read from the Scrolls, but they risk suffering the "price" of doing so.;;;;;;;;;;;;;x
shield_eleidon;Eleidon's Ward;;;;;;;;;;;;;x
shield_eleidon_desc;Eleidon was a holy knight of legend in Breton history. He was a sought after man for his courage and determination to set all wrongs right. In one story, it is said that he rescued a Baron's daughter from sure death at the hands of an evil warlord. For his reward, the Baron spent all of his riches to have an enchanted shield built for Eleidon.;;;;;;;;;;;;;x
elven_armour;Elven Armour;;;;;;;;;;;;;x
elven_armour_desc;A set of rare, gilded Elven Armour. What sets this suit of armour apart from standard Elven Armour isn't its capabilities, but rather the intricate gilding and engravings adorning its surface.;;;;;;;;;;;;;x
elven_bow;Elven Weapon;;;;;;;;;;;;;x
elven_bow_desc;An intricately engraved, masterwork example of Elven craftsmanship.;;;;;;;;;;;;;x
empire_declaration;Declaration of the Empire;;;;;;;;;;;;;x
empire_declaration_desc;This cylinder contains the original document declaring the formation of the Empire of Tamriel, drafted by the Elder Council and signed by the first Emperor themself.;;;;;;;;;;;;;x
fists_of_randagulf;Fists of Randagulf;;;;;;;;;;;;;x
fists_of_randagulf_desc;Randagulf of Clan Begalin goes down in Tamrielic history as one of the mightiest warriors from Skyrim. He was known for his courage and ferocity in battle and was a factor in many battles. He finally met his fate when King Harald conquered Skyrim. King Harald respected this great hero and took Randagulf's gauntlets for his own. After King Harald died, the gauntlets disappeared.;;;;;;;;;;;;;x
glass_armour;Glass Armour;;;;;;;;;;;;;x
glass_armour_desc;A rare suit of Glass Armour, amongst the finest craftswork available in all of Nirn.;;;;;;;;;;;;;x
glass_bow;Glass Bow;;;;;;;;;;;;;x
glass_bow_desc;A rare Glass Bow, amongst the finest craftswork available in all of Nirn.;;;;;;;;;;;;;x
glass_sword;Glass Weapon;;;;;;;;;;;;;x
